3951;160;"<a href=""https://howtoabroad.com/rhine-waal-university-of-applied-sciences/"" title=""Rhine-Waal University of Applied Sciences"" target=""_blank"" rel=""noopener"">Rhine-Waal University of Applied Sciences</a>";Master's degree;;Economics and Finance, MSc;NA;English;none;Winter, Summer;3 semesters;"<a href=""https://www.hochschule-rhein-waal.de/en/faculties/society-and-economics/degree-programmes/economics-and-finance-msc"" title=""Economics and Finance, MSc"" target=""_blank"" rel=""noopener"">Go to course website</a>";"<a href=""https://www.hochschule-rhein-waal.de/en/academics/prospective-students"" title=""Submit application"" target=""_blank"" rel=""noopener"">Submit application</a>"
3951;160;"<a href=""https://howtoabroad.com/rhine-waal-university-of-applied-sciences/"" title=""Rhine-Waal University of Applied Sciences"" target=""_blank"" rel=""noopener"">Rhine-Waal University of Applied Sciences</a>";Master's degree;;Sustainable Development Management, MA;;English;none;Winter, Summer;3 semesters;"<a href=""https://www.hochschule-rhein-waal.de/en/faculties/society-and-economics/degree-programmes/sustainable-development-management-ma"" title=""Sustainable Development Management, MA"" target=""_blank"" rel=""noopener"">Go to course website</a>";"<a href=""https://www.hochschule-rhein-waal.de/en/academics/prospective-students"" title=""Submit application"" target=""_blank"" rel=""noopener"">Submit application</a>"
3951;160;"<a href=""https://howtoabroad.com/rhine-waal-university-of-applied-sciences/"" title=""Rhine-Waal University of Applied Sciences"" target=""_blank"" rel=""noopener"">Rhine-Waal University of Applied Sciences</a>";Master's degree;;Sustainable Development Management, MA;;English;none;Winter, Summer;3 semesters;"<a href=""https://www.hochschule-rhein-waal.de/en/faculties/society-and-economics/degree-programmes/sustainable-development-management-ma"" title=""Sustainable Development Management, MA"" target=""_blank"" rel=""noopener"">Go to course website</a>";"<a href=""https://www.hochschule-rhein-waal.de/en/academics/prospective-students"" title=""Submit application"" target=""_blank"" rel=""noopener"">Submit application</a>"
3951;160;"<a href=""https://howtoabroad.com/rhine-waal-university-of-applied-sciences/"" title=""Rhine-Waal University of Applied Sciences"" target=""_blank"" rel=""noopener"">Rhine-Waal University of Applied Sciences</a>";Master's degree;;Bionics MSc;85 (For Biology);English;none;Winter, Summer;3 semesters;"<a href=""https://www.hochschule-rhein-waal.de/en/faculties/technology-and-bionics/degree-programmes/bionicsbiomimetics-msc"" title=""Bionics MSc"" target=""_blank"" rel=""noopener"">Go to course website</a>";"<a href=""https://www.hochschule-rhein-waal.de/en/academics/prospective-students"" title=""Submit application"" target=""_blank"" rel=""noopener"">Submit application</a>"
3951;160;"<a href=""https://howtoabroad.com/rhine-waal-university-of-applied-sciences/"" title=""Rhine-Waal University of Applied Sciences"" target=""_blank"" rel=""noopener"">Rhine-Waal University of Applied Sciences</a>";Bachelor's degree;;Mechanical Engineering, BSc;NA;English;none;Winter;7 semesters;"<a href=""https://www.hochschule-rhein-waal.de/en/faculties/technology-and-bionics/degree-programmes/mechanical-engineering-bsc"" title=""Mechanical Engineering, BSc"" target=""_blank"" rel=""noopener"">Go to course website</a>";"<a href=""http://www.hochschule-rhein-waal.de/en/academics/prospective-students"" title=""Submit application"" target=""_blank"" rel=""noopener"">Submit application</a>"
3951;160;"<a href=""https://howtoabroad.com/rhine-waal-university-of-applied-sciences/"" title=""Rhine-Waal University of Applied Sciences"" target=""_blank"" rel=""noopener"">Rhine-Waal University of Applied Sciences</a>";Master's degree;;Mechanical Engineering, MSc;NA;English;none;Winter, Summer;3 semesters;"<a href=""https://www.hochschule-rhein-waal.de/en/faculties/technology-and-bionics/degree-programmes/mechanical-engineering-msc"" title=""Mechanical Engineering, MSc"" target=""_blank"" rel=""noopener"">Go to course website</a>";"<a href=""http://www.hochschule-rhein-waal.de/en/academics/prospective-students"" title=""Submit application"" target=""_blank"" rel=""noopener"">Submit application</a>"
6354;240;"<a href=""https://howtoabroad.com/stralsund-university-of-applied-sciences/"" title=""Stralsund University of Applied Sciences"" target=""_blank"" rel=""noopener"">Stralsund University of Applied Sciences</a>";Master's degree;;Simulation and System Design (SSD);NA;English;none;Winter, Summer;4 semesters;"<a href=""https://www.hochschule-stralsund.de/host/fakultaeten/maschinenbau/studienangebot/master-simulation-and-system-design/"" title=""Simulation and System Design (SSD)"" target=""_blank"" rel=""noopener"">Go to course website</a>";"<a href=""https://www2.daad.de/deutschland/studienangebote/international-programmes/en/detail/6445/"" title=""Submit application"" target=""_blank"" rel=""noopener"">Submit application</a>"
6354;240;"<a href=""https://howtoabroad.com/stralsund-university-of-applied-sciences/"" title=""Stralsund University of Applied Sciences"" target=""_blank"" rel=""noopener"">Stralsund University of Applied Sciences</a>";Master's degree;;Renewable Energy and E-Mobility (REEM);NA;English;none;Winter, Summer;3 semesters;"<a href=""https://www.hochschule-stralsund.de/reemm/"" title=""Renewable Energy and E-Mobility (REEM)"" target=""_blank"" rel=""noopener"">Go to course website</a>";"<a href=""https://my.uni-assist.de/"" title=""Submit application"" target=""_blank"" rel=""noopener"">Submit application</a>"
6250;236;"<a href=""https://howtoabroad.com/hof-university-of-applied-sciences/"" title=""Hof University of Applied Sciences"" target=""_blank"" rel=""noopener"">Hof University of Applied Sciences</a>";Master's degree;;Applied Research in Computer Science (MSc);NA;English;none;Winter, Summer;3 semesters;"<a href=""https://www.hof-university.com/studying-in-hof/full-time-programs/master/applied-research-in-computer-science-msc.html"" title=""Applied Research in Computer Science (MSc)"" target=""_blank"" rel=""noopener"">Go to course website</a>";"<a href=""https://www3.primuss.de/cgi-bin/bew_anmeldung_v2/"" title=""Submit application"" target=""_blank"" rel=""noopener"">Submit application</a>"
6250;236;"<a href=""https://howtoabroad.com/hof-university-of-applied-sciences/"" title=""Hof University of Applied Sciences"" target=""_blank"" rel=""noopener"">Hof University of Applied Sciences</a>";Master's degree;;Global Management;;English;none;Winter, Summer;3 semesters;"<a href=""https://www.hof-university.com/studying-in-hof/full-time-programs/master/global-management-ma.html"" title=""Global Management"" target=""_blank"" rel=""noopener"">Go to course website</a>";"<a href=""https://www3.primuss.de/cgi-bin/bew_anmeldung_v2/index.pl?Session=&FH=fhh&Email=&Portal=1&Language=en"" title=""Submit application"" target=""_blank"" rel=""noopener"">Submit application</a>"
6250;236;"<a href=""https://howtoabroad.com/hof-university-of-applied-sciences/"" title=""Hof University of Applied Sciences"" target=""_blank"" rel=""noopener"">Hof University of Applied Sciences</a>";Master's degree;;Sustainable Textiles (MEng);;English;none;Winter, Summer;3 semesters;"<a href=""https://www.hof-university.com/studying-in-hof/full-time-programs/master/sustainable-textiles-meng.html"" title=""Sustainable Textiles (MEng)"" target=""_blank"" rel=""noopener"">Go to course website</a>";"<a href=""https://www3.primuss.de/cgi-bin/bew_anmeldung_v2/index.pl?Session=&FH=fhh&Email=&Portal=1&Language=en"" title=""Submit application"" target=""_blank"" rel=""noopener"">Submit application</a>"
5199;205;"<a href=""https://howtoabroad.com/ansbach-university-of-applied-sciences/"" title=""Ansbach University of Applied Sciences"" target=""_blank"" rel=""noopener"">Ansbach University of Applied Sciences</a>";Master's degree;;International Product and Service Management (IPM);;English;none;Winter, Summer;3 semesters;"<a href=""https://www.hs-ansbach.de/en/master/international-product-and-service-management/"" title=""International Product and Service Management (IPM)"" target=""_blank"" rel=""noopener"">Go to course website</a>";"<a href=""https://www3.primuss.de/cgi-bin/bew_anmeldung/index.pl?FH=fhan"" title=""Submit application"" target=""_blank"" rel=""noopener"">Submit application</a>"
3531;143;"<a href=""https://howtoabroad.com/augsburg-university-of-applied-sciences/"" title=""Augsburg University of Applied Sciences"" target=""_blank"" rel=""noopener"">Augsburg University of Applied Sciences</a>";Master's degree;;Interactive Media Systems;;English;none;Winter, Summer;3 semesters;"<a href=""https://www.hs-augsburg.de/en/Design/Interactive-Media/Interactive-Media-Systems-M.A..html"" title=""Interactive Media Systems"" target=""_blank"" rel=""noopener"">Go to course website</a>";"<a href=""https://www.hs-augsburg.de/en/Application.html"" title=""Submit application"" target=""_blank"" rel=""noopener"">Submit application</a>"
5606;215;"<a href=""https://howtoabroad.com/university-of-applied-sciences-bremerhaven/"" title=""University of Applied Sciences Bremerhaven"" rel=""noopener"" target=""_blank"">University of Applied Sciences Bremerhaven</a>  ";Master's degree;;Embedded Systems Design;NA;English;none;Summer;3 semesters;"<a href=""https://www.hs-bremerhaven.de/en/study-courses/master/embedded-systems-design/"" title=""Embedded Systems Design"" target=""_blank"" rel=""noopener"">Go to course website</a>";
3658;149;"<a href=""https://howtoabroad.com/hochschule-emden-leer/"" title=""Hochschule Emden/Leer - University of Applied Sciences"" target=""_blank"" rel=""noopener"">Hochschule Emden/Leer - University of Applied Sciences</a>";Master's degree;;Master in Industrial Informatics - Specialisation Industrial Cyber-Physical Systems;;English;none;Winter, Summer;3 semesters;"<a href=""https://www.hs-emden-leer.de/en/current-students/faculties/technology/study-programs/industrial-informatics-master"" title=""Master in Industrial Informatics - Specialisation Industrial Cyber-Physical Systems"" target=""_blank"" rel=""noopener"">Go to course website</a>";"<a href=""https://www.uni-assist.de/online/hs-emden-leer"" title=""Submit application"" target=""_blank"" rel=""noopener"">Submit application</a>"
2720;101;"<a href=""https://howtoabroad.com/fulda-university-of-applied-sciences/"" title=""Fulda University of Applied Sciences"" target=""_blank"" rel=""noopener"">Fulda University of Applied Sciences</a>";Master's degree;;Global Software Development (MSc);;English;none;Winter, Summer;3 semesters;"<a href=""https://www.hs-fulda.de/en/international/international-office/admissions/degree-programmes/studiengang/global-software-development-msc/show"" title=""Global Software Development (MSc)"" target=""_blank"" rel=""noopener"">Go to course website</a>";"<a href=""https://www.uni-assist.de/en/"" title=""Submit application"" target=""_blank"" rel=""noopener"">Submit application</a>"
2720;101;"<a href=""https://howtoabroad.com/fulda-university-of-applied-sciences/"" title=""Fulda University of Applied Sciences"" target=""_blank"" rel=""noopener"">Fulda University of Applied Sciences</a>";Bachelor's degree;;International Business & Management (IBM);;English;none;Winter, Summer;7 semesters;"<a href=""https://www.hs-fulda.de/en/studies/departments/business/our-study-programmes/study-programmes/international-business-management-bsc"" title=""International Business & Management (IBM)"" target=""_blank"" rel=""noopener"">Go to course website</a>";"<a href=""https://www.hs-fulda.de/en/international/international-office/admissions/undergraduate-admissions/"" title=""Submit application"" target=""_blank"" rel=""noopener"">Submit application</a>"
5725;218;"<a href=""https://howtoabroad.com/harz-university-of-applied-sciences/"" title=""Harz University of Applied Sciences"" target=""_blank"" rel=""noopener"">Harz University of Applied Sciences</a>";Master's degree;;Technology and Innovation Management;;English;none;Winter, Summer;4 semesters;"<a href=""https://www.hs-harz.de/en/technology-and-innovation-management"" title=""Technology and Innovation Management"" target=""_blank"" rel=""noopener"">Go to course website</a>";"<a href=""https://www.uni-assist.de/"" title=""Submit application"" target=""_blank"" rel=""noopener"">Submit application</a>"
3282;134;"<a href=""https://howtoabroad.com/kaiserslautern-university-of-applied-sciences/"" title=""Kaiserslautern University of Applied Sciences"" target=""_blank"" rel=""noopener"">Kaiserslautern University of Applied Sciences</a>";Master's degree;;Mechanical Engineering/Mechatronics (MEng);15 (For Mechanical Engineering);English;none;Winter, Summer;3 semesters;"<a href=""https://www.hs-kl.de/angewandte-ingenieurwissenschaften/studiengaenge/master/mechanical-engineeringmechatronics"" title=""Mechanical Engineering/Mechatronics (MEng)"" target=""_blank"" rel=""noopener"">Go to course website</a>";"<a href=""https://www.uni-assist.de/"" title=""Submit application"" target=""_blank"" rel=""noopener"">Submit application</a>"
3282;134;"<a href=""https://howtoabroad.com/kaiserslautern-university-of-applied-sciences/"" title=""Kaiserslautern University of Applied Sciences"" target=""_blank"" rel=""noopener"">Kaiserslautern University of Applied Sciences</a>";Master's degree;;Refinement of Polymer and Composite Products;NA;English;none;Winter, Summer;3 semesters;"<a href=""https://www.hs-kl.de/angewandte-logistik-und-polymerwissenschaften/studiengaenge/refinement-of-polymer-and-composite-products"" title=""Refinement of Polymer and Composite Products"" target=""_blank"" rel=""noopener"">Go to course website</a>";"<a href=""https://www.uni-assist.de/"" title=""Submit application"" target=""_blank"" rel=""noopener"">Submit application</a>"
3282;134;"<a href=""https://howtoabroad.com/kaiserslautern-university-of-applied-sciences/"" title=""Kaiserslautern University of Applied Sciences"" target=""_blank"" rel=""noopener"">Kaiserslautern University of Applied Sciences</a>";Master's degree;;Financial Services Management;;English;none;Winter, Summer;3 semesters;"<a href=""https://www.hs-kl.de/betriebswirtschaft/studiengaenge/master/financial-services-management"" title=""Financial Services Management"" target=""_blank"" rel=""noopener"">Go to course website</a>";"<a href=""https://www.hs-kl.de/en/studying/application/applying-for-a-masters-degree-course/"" title=""Submit application"" target=""_blank"" rel=""noopener"">Submit application</a>"
5127;203;"<a href=""https://howtoabroad.com/neubrandenburg-university-of-applied-sciences/"" title=""Neubrandenburg University of Applied Sciences"" rel=""noopener"" target=""_blank"">Neubrandenburg University of Applied Sciences</a>   ";Master's degree;;Geodesy and Geoinformatics;;English;none;Winter, Summer;3 semesters;"<a href=""https://www.hs-nb.de/en/courses-of-study/postgraduate-courses/geodesy-and-geoinformatics-meng/"" title=""Geodesy and Geoinformatics"" target=""_blank"" rel=""noopener"">Go to course website</a>";"<a href=""https://www.uni-assist.de/en/"" title=""Submit application"" target=""_blank"" rel=""noopener"">Submit application</a>"
5127;203;"<a href=""https://howtoabroad.com/neubrandenburg-university-of-applied-sciences/"" title=""Neubrandenburg University of Applied Sciences"" rel=""noopener"" target=""_blank"">Neubrandenburg University of Applied Sciences</a>   ";Master's degree;;Landscape Studies and Greenspace Management;NA;English;none;Winter, Summer;4 semesters;"<a href=""https://www.hs-nb.de/studiengaenge/master/landscape-studies-and-greenspace-management-meng/"" title=""Landscape Studies and Greenspace Management"" target=""_blank"" rel=""noopener"">Go to course website</a>";"<a href=""https://www.uni-assist.de/en/"" title=""Submit application"" target=""_blank"" rel=""noopener"">Submit application</a>"
4463;174;"<a href=""https://howtoabroad.com/offenburg-university/"" title=""Osnabruck University of Applied Sciences"" target=""_blank"" rel=""noopener"">Osnabruck University of Applied Sciences</a>";Master's degree;;International Business and Management (MA);;English;none;Winter;4 semesters;"<a href=""https://www.hs-osnabrueck.de/en/study/study-offerings/master/international-business-and-management-ma/"" title=""International Business and Management (MA)"" target=""_blank"" rel=""noopener"">Go to course website</a>";"<a href=""https://osca-bew.hs-osnabrueck.de/scripts/mgrqispi.dll?APPNAME=CampusNet&PRGNAME=EXTERNALPAGES&ARGUMENTS=-N000000000000002,-N000344,-Ahsoswelcomeen"" title=""Submit application"" target=""_blank"" rel=""noopener"">Submit application</a>"
4130;165;"<a href=""https://howtoabroad.com/university-of-wurzburg/"" title=""Julius-Maximilians-Universität Würzburg"" target=""_blank"" rel=""noopener"">Julius-Maximilians-Universität Würzburg</a> ";Master's degree;;Molecular and Computational Biology, Master of Science;10 (For Computational Biology), 6 (For Molecular Biology);English;none;Winter, Summer;4 semesters;"<a href=""https://www.hs-schmalkalden.de/en/studying/programmes/master-degree-courses/applied-computer-science-msc.html#c42589"" title=""Molecular and Computational Biology, Master of Science"" target=""_blank"" rel=""noopener"">Go to course website</a>";
8056;305;"<a href=""https://howtoabroad.com/fh-schmalkalden-university-of-applied-sciences/"" title=""University of Applied Sciences Schmalkalden"" target=""_blank"" rel=""noopener"">University of Applied Sciences Schmalkalden</a>";Master's degree;;Master of Arts in International Business and Economics;NA;English;none;Winter;4 semesters;"<a href=""https://www.hs-schmalkalden.de/en/studying/programmes/master-degree-courses/international-business-and-economics-ma.html#c14904"" title=""Master of Arts in International Business and Economics"" target=""_blank"" rel=""noopener"">Go to course website</a>";
4596;183;"<a href=""https://howtoabroad.com/worms-university-of-applied-sciences/"" title=""Worms University of Applied Sciences"" rel=""noopener"" target=""_blank"">Worms University of Applied Sciences</a>  ";Master's degree;;Global Trade Management Master of Arts;NA;English;none;Winter, Summer;4 semesters;"<a href=""https://www.hs-worms.de/en/fachbereiche/business-sciences/degree-course-international-business-administration/gtm-master/"" title=""Global Trade Management Master of Arts"" target=""_blank"" rel=""noopener"">Go to course website</a>";
4596;183;"<a href=""https://howtoabroad.com/worms-university-of-applied-sciences/"" title=""Worms University of Applied Sciences"" rel=""noopener"" target=""_blank"">Worms University of Applied Sciences</a>  ";Bachelor's degree;;Aviation Management Bachelor of Arts;NA;English;none;Summer;7 semesters;"<a href=""https://www.hs-worms.de/en/fachbereiche/touristikverkehrswesen/course-of-studies/bachelor/aviation-management/admissions-requirements/"" title=""Aviation Management Bachelor of Arts"" target=""_blank"" rel=""noopener"">Go to course website</a>";
NA;NA;"<a href=""https://howtoabroad.com/htw-dresden-university-of-applied-sciences/"" title=""HTW Dresden - University of Applied Sciences"" target=""_blank"" rel=""noopener"">HTW Dresden - University of Applied Sciences</a>";Master's degree;;Master of International Management (MA);;English;none;Summer;3 semesters;"<a href=""https://www.htw-dresden.de/studium/vor-dem-studium/studienangebot/master-international-management"" title=""Master of International Management (MA)"" target=""_blank"" rel=""noopener"">Go to course website</a>";"<a href=""http://www.uni-assist.de/index_en.html"" title=""Submit application"" target=""_blank"" rel=""noopener"">Submit application</a>"
5269;207;"<a href=""https://howtoabroad.com/htw-saar-university-of-applied-sciences/"" title=""htw saar"" target=""_blank"" rel=""noopener"">htw saar - University of Applied Sciences</a>";Master's degree;;International Management;;English;none;Winter;4 semesters;"<a href=""https://www.htwsaar.de/studium-und-lehre/studienangebot/studiengaenge/international-management_master"" title=""International Management"" target=""_blank"" rel=""noopener"">Go to course website</a>";"<a href=""https://www.uni-assist.de/en/"" title=""Submit application"" target=""_blank"" rel=""noopener"">Submit application</a>"
2469;95;"<a href=""https://howtoabroad.com/hwr-berlin/"" title=""Hochschule fur Wirtschaft und Recht Berlin"" target=""_blank"" rel=""noopener"">HWR Berlin</a>";Master's degree;;International Security Management;;English;none;Summer;4 semesters;"<a href=""https://www.hwr-berlin.de/en/study/degree-programmes/detail/55-international-security-management/"" title=""International Security Management"" target=""_blank"" rel=""noopener"">Go to course website</a>";"<a href=""https://www.uni-assist.de/en/"" title=""Submit application"" target=""_blank"" rel=""noopener"">Submit application</a>"
2469;95;"<a href=""https://howtoabroad.com/hwr-berlin/"" title=""Hochschule fur Wirtschaft und Recht Berlin"" target=""_blank"" rel=""noopener"">HWR Berlin</a>";Bachelor's degree;;International Business Management;;English;none;Winter, Summer;8 semesters;"<a href=""https://www.hwr-berlin.de/en/study/degree-programmes/detail/68-international-business-management/"" title=""International Business Management"" target=""_blank"" rel=""noopener"">Go to course website</a>";"<a href=""https://my.uni-assist.de/"" title=""Submit application"" target=""_blank"" rel=""noopener"">Submit application</a>"
202;16;"<a href=""https://howtoabroad.com/friedrich-alexander-university/"" title=""FAU Erlangen-Nurnberg"" target=""_blank"" rel=""noopener"">FAU Erlangen-Nurnberg</a>";Master's degree;Erlangen;Graduate Programme in Labour Market Research of the Institute for Employment Research (IAB) and the School of Business and Economics;28 (For Economics), 14 (For Business);English;;;6 semesters;"<a href=""https://www.iab.de/en/ueberblick/graduiertenprogramm.aspx"" title=""Graduate Programme in Labour Market Research of the Institute for Employment Research (IAB) and the School of Business and Economics"" target=""_blank"" rel=""noopener"">Go to course website</a>";"<a href=""https://www.iab.de/en/ueberblick/graduiertenprogramm/bewerbung.aspx"" title=""Submit application"" target=""_blank"" rel=""noopener"">Submit application</a>"
56;1;"<a href=""https://howtoabroad.com/ludwig-maximilians-university-munich/"" title=""Ludwig Maximilians University Munich"" rel=""noopener"" target=""_blank"">Ludwig Maximilians University Munich (LMU)</a>";PhD / Doctorate;Munich;PhD Medical Research - Epidemiology & Public Health;1 (For Epidemiology), 2 (For Public Health);English;;Winter semester;6 semesters;"<a href=""https://www.ibe.med.uni-muenchen.de/phd-studiengang/index.html"" title=""PhD Medical Research - Epidemiology & Public Health"" target=""_blank"" rel=""noopener"">Go to course website</a>";"<a href=""https://www.ibe.med.uni-muenchen.de/phd-studiengang/application/index.html"" title=""Submit application"" target=""_blank"" rel=""noopener"">Submit application</a>"
149;9;"<a href=""https://howtoabroad.com/humboldt-university-of-berlin/"" title=""Humboldt-Universität zu Berlin"" rel=""noopener"" target=""_blank"">Humboldt-Universität zu Berlin</a>   ";Master's degree;Berlin;Information Science (INFOSCI);6 (For Library and Information science);German,English;none;Winter, Summer;4 semesters;"<a href=""https://www.ibi.hu-berlin.de/de/studium/studiengaenge/master"" title=""Information Science (INFOSCI)"" target=""_blank"" rel=""noopener"">Go to course website</a>";"<a href=""https://studienplatz.hu-berlin.de/bewerbungOnline/rds?state=onlstat"" title=""Submit application"" target=""_blank"" rel=""noopener"">Submit application</a>"
264;23;"<a href=""https://howtoabroad.com/university-of-stuttgart/"" title=""University of Stuttgart"" rel=""noopener"" target=""_blank"">University of Stuttgart</a>   ";PhD / Doctorate;Stuttgart;Integrative Technologies and Architectural Design Research (ITECH);1 (For Art and Design);English;varied;Winter;4 semesters;"<a href=""https://www.icd.uni-stuttgart.de/teaching/itech/"" title=""Integrative Technologies and Architectural Design Research (ITECH)"" target=""_blank"" rel=""noopener"">Go to course website</a>";"<a href=""https://www.itech.uni-stuttgart.de/news/ITECH-is-now-accepting-applications-00001/"" title=""Submit application"" target=""_blank"" rel=""noopener"">Submit application</a>"
73;2;"<a href=""https://howtoabroad.com/heidelberg-university/"" title=""Universität Heidelberg"" rel=""noopener"" target=""_blank"">Universität Heidelberg</a>";Bachelor's degree;Heidelberg;BA German Studies in Cultural Comparison;;German;varied;Winter, Summer;6 semesters;"<a href=""https://www.idf.uni-heidelberg.de/studiengaenge/ba-gik.html"" title=""BA German Studies in Cultural Comparison"" target=""_blank"" rel=""noopener"">Go to course website</a>";"<a href=""https://www.uni-heidelberg.de/einrichtungen/verwaltung/internationales/d7_1.html"" title=""Submit application"" target=""_blank"" rel=""noopener"">Submit application</a>"
131;6;"<a href=""https://howtoabroad.com/the-university-of-hamburg/"" title=""Universität Hamburg"" rel=""noopener"" target=""_blank"">Universität Hamburg</a>";Master's degree;Hamburg;Master of Science in Ocean and Climate Physics (MSc);9 (For Physics);English;none;Winter;4 semesters;"<a href=""https://www.ifm.uni-hamburg.de/en/education/master.html"" title=""Master of Science in Ocean and Climate Physics (MSc)"" target=""_blank"" rel=""noopener"">Go to course website</a>";"<a href=""https://www.uni-hamburg.de/online-application"" title=""Submit application"" target=""_blank"" rel=""noopener"">Submit application</a>"
